Name,Category,Ingredients,Price
Margherita,Vegetarian,"Tomato Sauce, Mozzarella, Basil",15
Pepperoni,Meat Lovers,"Tomato Sauce, Mozzarella, Pepperoni",16
Hawaiian,Specialty,"Tomato Sauce, Mozzarella, Ham, Pineapple",17
BBQ Chicken,Specialty,"Barbecue Sauce, Chicken, Red Onion, Mozzarella",15
Veggie Delight,Vegetarian,"Tomato Sauce, Mozzarella, Bell Peppers, Mushrooms, Olives",16
Meat Feast,Meat Lovers,"Tomato Sauce, Mozzarella, Sausage, Bacon, Pepperoni, Ground Beef",18
Supreme,Specialty,"Tomato Sauce, Mozzarella, Pepperoni, Sausage, Bell Peppers, Mushrooms, Onions, Olives",20
