Name,Description,Ingredients,Price
Classic Margherita,"A classic Margherita pizza with tomato sauce,fresh mozzarella,and basil","Tomato Sauce,Mozzarella,Basil",10
Pepperoni Lover's,"Loaded with pepperoni,tomato sauce,and mozzarella","Tomato Sauce,Mozzarella,Pepperoni",12
Hawaiian Delight,"A tropical delight with ham,pineapple,tomato sauce,and mozzarella","Tomato Sauce,Mozzarella,Ham,Pineapple",13
Veggie Supreme,"A vegetarian delight with tomato sauce,mozzarella,bell peppers,mushrooms,onions,and olives","Tomato Sauce,Mozzarella,Bell Peppers,Mushrooms,Onions,Olives",11
Meat Extravaganza,"A meat lover's dream with tomato sauce,mozzarella,sausage,bacon,pepperoni,and ground beef","Tomato Sauce,Mozzarella,Sausage,Bacon,Pepperoni,Ground Beef",14
